{"prefix": {"ex": "http://example.org/", "w3": "http://www.w3.org/", "tr": "http://www.w3.org/TR/2011/", "process": "http://www.w3.org/2005/10/Process-20051014/tr.html#", "email": "https://lists.w3.org/Archives/Member/w3c-archive/", "chairs": "https://lists.w3.org/Archives/Member/chairs/", "trans": "http://www.w3.org/2005/08/01-transitions.html#", "rec54": "http://www.w3.org/2001/02pd/rec54#"}, "entity": {"tr:WD-prov-dm-20111018": {"prov:type": "rec54:WD"}, "tr:WD-prov-dm-20111215": {"prov:type": "rec54:WD"}, "process:rec-advance": {"prov:type": {"$": "prov:Plan", "type": "xsd:QName"}}, "chairs:2011OctDec/0004": {"prov:type": "trans:transreq"}, "email:2011Oct/0141": {"prov:type": "trans:pubreq"}, "email:2011Dec/0111": {"prov:type": "trans:pubreq"}}, "wasDerivedFrom": {"_:id1": {"prov:generatedEntity": "tr:WD-prov-dm-20111215", "prov:usedEntity": "tr:WD-prov-dm-20111018"}}, "activity": {"ex:act1": {"prov:type": "publish"}, "ex:act2": {"prov:type": "publish"}}, "wasGeneratedBy": {"_:id2": {"prov:entity": "tr:WD-prov-dm-20111018", "prov:activity": "ex:act1"}, "_:id3": {"prov:entity": "tr:WD-prov-dm-20111215", "prov:activity": "ex:act2"}}, "used": {"_:id4": {"prov:activity": "ex:act1", "prov:entity": "chairs:2011OctDec/0004"}, "_:id5": {"prov:activity": "ex:act1", "prov:entity": "email:2011Oct/0141"}, "_:id6": {"prov:activity": "ex:act2", "prov:entity": "email:2011Dec/0111"}}, "agent": {"w3:Consortium": {"prov:type": {"$": "prov:Organization", "type": "xsd:QName"}}}, "wasAssociatedWith": {"_:id7": {"prov:activity": "ex:act1", "prov:agent": "w3:Consortium", "prov:plan": "process:rec-advance"}, "_:id8": {"prov:activity": "ex:act2", "prov:agent": "w3:Consortium", "prov:plan": "process:rec-advance"}}}