{"prefix": {"hg": "http://dvcs.w3.org/hg/prov/raw-file/9628aaff6e20/model/releases/WD-prov-dm-20111215/", "w3": "http://www.w3.org/TR/2011/", "ex": "http://example.org/", "rec": "http://example.org/record"}, "entity": {"hg:Overview.html": {"prov:type": "file in hg"}, "w3:WD-prov-dm-20111215": {"prov:type": "html4"}, "ex:req3": {"prov:type": {"$": "http://www.w3.org/2005/08/01-transitions.html#pubreq", "type": "xsd:anyURI"}}}, "activity": {"ex:rcp": {"prov:type": "copy directory"}}, "wasGeneratedBy": {"rec:g": {"prov:entity": "w3:WD-prov-dm-20111215", "prov:activity": "ex:rcp"}}, "used": {"rec:u": {"prov:activity": "ex:rcp", "prov:entity": "hg:Overview.html"}, "_:id1": {"prov:activity": "ex:rcp", "prov:entity": "ex:req3"}}, "wasDerivedFrom": {"_:id2": {"prov:generatedEntity": "w3:WD-prov-dm-20111215", "prov:usedEntity": "hg:Overview.html", "prov:activity": "ex:rcp", "prov:generation": "rec:g", "prov:usage": "rec:u"}}, "agent": {"ex:webmaster": {"prov:type": {"$": "prov:Person", "type": "xsd:QName"}}}, "wasAssociatedWith": {"_:id3": {"prov:activity": "ex:rcp", "prov:agent": "ex:webmaster"}}}