{"prefix": {"ex": "http://www.example.com/", "alice": "http://example.org/alice/", "bob": "http://example.org/bob/"}, "entity": {"bob:bundle4": {"prov:type": {"$": "prov:Bundle", "type": "xsd:QName"}}, "alice:bundle5": {"prov:type": {"$": "prov:Bundle", "type": "xsd:QName"}}}, "wasGeneratedBy": {"_:id1": {"prov:entity": "bob:bundle4", "prov:time": "2012-05-24T10:30:00"}, "_:id3": {"prov:entity": "alice:bundle5", "prov:time": "2012-05-25T11:15:00"}}, "agent": {"ex:Bob": {}, "ex:Alice": {}}, "wasAttributedTo": {"_:id2": {"prov:entity": "bob:bundle4", "prov:agent": "ex:Bob"}, "_:id4": {"prov:entity": "alice:bundle5", "prov:agent": "ex:Alice"}}, "bundle": {"bob:bundle4": {"entity": {"ex:report1": {"prov:type": "report", "ex:version": {"$": "1", "type": "xsd:int"}}}, "wasGeneratedBy": {"_:id1": {"prov:entity": "ex:report1", "prov:time": "2012-05-24T10:00:01"}}}, "alice:bundle5": {"entity": {"ex:report1bis": {}, "ex:report2": {"prov:type": "report", "ex:version": {"$": "2", "type": "xsd:int"}}}, "mentionOf": {"_:id1": {"prov:specificEntity": "ex:report1bis", "prov:generalEntity": "ex:report1", "prov:bundle": "bob:bundle4"}}, "wasGeneratedBy": {"_:id2": {"prov:entity": "ex:report2", "prov:time": "2012-05-25T11:00:01"}}, "wasDerivedFrom": {"_:id3": {"prov:generatedEntity": "ex:report2", "prov:usedEntity": "ex:report1bis"}}}}}