{
  "wasAssociatedWith": {
    "_:wAW1": {
      "prov:activity": "w3:Consortium",
      "prov:agent": "ex:pub1",
      "prov:plan": "pr:rec-advance"
    },
    "_:wAW2": {
      "prov:activity": "w3:Consortium",
      "prov:agent": "ex:pub2",
      "prov:plan": "pr:rec-advance"
    }
  },
  "wasGeneratedBy": {
    "_:wGB1": {
      "prov:activity": "ex:pub1",
      "prov:entity": "tr:WD-prov-dm-20111018"
    },
    "_:wGB2": {
      "prov:activity": "ex:pub2",
      "prov:entity": "tr:WD-prov-dm-20111215"
    }
  },
  "entity": {
    "pr:rec-advance": {
      "prov:type": [
        "prov:Plan",
        "xsd:QName"
      ]
    },
    "w3:Consortium": {
      "prov:type": "Organization"
    },
    "tr:WD-prov-dm-20111215": {
      "prov:type": [
        "pr:RecsWD",
        "xsd:QName"
      ]
    },
    "ar2:0141": {
      "prov:type": [
        "http://www.w3.org/2005/08/01-transitions.html#pubreq",
        "xsd:anyURI"
      ]
    },
    "ar3:0111": {
      "prov:type": [
        "http://www.w3.org/2005/08/01-transitions.html#pubreq",
        "xsd:anyURI"
      ]
    },
    "tr:WD-prov-dm-20111018": {
      "prov:type": [
        "pr:RecsWD",
        "xsd:QName"
      ]
    },
    "ar1:0004": {
      "prov:type": [
        "http://www.w3.org/2005/08/01-transitions.html#transreq",
        "xsd:anyURI"
      ]
    }
  },
  "prefix": {
    "ar1": "https://lists.w3.org/Archives/Member/chairs/2011OctDec/",
    "ar2": "https://lists.w3.org/Archives/Member/w3c-archive/2011Oct/",
    "ex": "http://example.org/",
    "ar3": "https://lists.w3.org/Archives/Member/w3c-archive/2011Dec/",
    "tr": "http://www.w3.org/TR/2011/",
    "w3": "http://www.w3.org/",
    "pr": "http://www.w3.org/2005/10/Process-20051014/tr.html#"
  },
  "wasDerivedFrom": {
    "_:wDF1": {
      "prov:generatedEntity": "tr:WD-prov-dm-20111215",
      "prov:usedEntity": "tr:WD-prov-dm-20111018"
    }
  },
  "used": {
    "_:u1": {
      "prov:activity": "ex:pub1",
      "prov:entity": "ar1:0004"
    },
    "_:u3": {
      "prov:activity": "ex:pub2",
      "prov:entity": "ar3:0111"
    },
    "_:u2": {
      "prov:activity": "ex:pub1",
      "prov:entity": "ar2:0141"
    }
  },
  "activity": {
    "ex:pub1": {
      "prov:type": "publish"
    },
    "ex:pub2": {
      "prov:type": "publish"
    }
  }
}
