{"prefix": {"dcterms": "http://purl.org/dc/terms/", "foaf": "http://xmlns.com/foaf/0.1/", "ex": "http://example/"}, "entity": {"ex:article": {"dcterms:title": "Crime rises in cities"}, "ex:articleV1": {}, "ex:articleV2": {}, "ex:dataSet1": {}, "ex:dataSet2": {}, "ex:regionList": {}, "ex:composition": {}, "ex:chart1": {}, "ex:chart2": {}, "ex:blogEntry": {}}, "activity": {"ex:compile": {}, "ex:compile2": {}, "ex:compose": {}, "ex:correct": {"prov:startTime": "2012-03-31T09:21:00", "prov:endTime": "2012-04-01T15:21:00"}, "ex:illustrate": {}}, "used": {"_:id1": {"prov:activity": "ex:compose", "prov:entity": "ex:dataSet1", "prov:role": "ex:dataToCompose"}, "_:id2": {"prov:activity": "ex:compose", "prov:entity": "ex:regionList", "prov:role": "ex:regionsToAggregateBy"}, "_:id4": {"prov:activity": "ex:illustrate", "prov:entity": "ex:composition"}, "_:id12": {"prov:activity": "ex:correct", "prov:entity": "ex:dataSet1"}}, "wasGeneratedBy": {"_:id3": {"prov:entity": "ex:composition", "prov:activity": "ex:compose"}, "_:id5": {"prov:entity": "ex:chart1", "prov:activity": "ex:illustrate"}, "_:id6": {"prov:entity": "ex:chart1", "prov:activity": "ex:compile", "prov:time": "2012-03-02T10:30:00"}, "_:id11": {"prov:entity": "ex:dataSet2", "prov:activity": "ex:correct"}}, "agent": {"ex:derek": {"prov:type": {"$": "prov:Person", "type": "xsd:QName"}, "foaf:givenName": "Derek", "foaf:mbox": "<mailto:derek@example.org>"}, "ex:chartgen": {"prov:type": {"$": "prov:Organization", "type": "xsd:QName"}, "foaf:name": "Chart Generators Inc"}}, "wasAssociatedWith": {"_:id7": {"prov:activity": "ex:compose", "prov:agent": "ex:derek"}, "_:id8": {"prov:activity": "ex:illustrate", "prov:agent": "ex:derek"}}, "actedOnBehalfOf": {"_:id9": {"prov:delegate": "ex:derek", "prov:responsible": "ex:chartgen", "prov:activity": "ex:compose"}}, "wasAttributedTo": {"_:id10": {"prov:entity": "ex:chart1", "prov:agent": "ex:derek"}}, "wasDerivedFrom": {"_:id13": {"prov:generatedEntity": "ex:dataSet2", "prov:usedEntity": "ex:dataSet1", "prov:type": {"$": "prov:Revision", "type": "xsd:QName"}}, "_:id14": {"prov:generatedEntity": "ex:chart2", "prov:usedEntity": "ex:dataSet2"}, "_:id15": {"prov:generatedEntity": "ex:blogEntry", "prov:usedEntity": "ex:article", "prov:type": {"$": "prov:Quotation", "type": "xsd:QName"}}, "_:id17": {"prov:generatedEntity": "ex:articleV1", "prov:usedEntity": "ex:dataSet1"}, "_:id19": {"prov:generatedEntity": "ex:articleV2", "prov:usedEntity": "ex:dataSet2"}}, "specializationOf": {"_:id16": {"prov:specificEntity": "ex:articleV1", "prov:generalEntity": "ex:article"}, "_:id18": {"prov:specificEntity": "ex:articleV2", "prov:generalEntity": "ex:article"}}, "alternateOf": {"_:id20": {"prov:alternate1": "ex:articleV2", "prov:alternate2": "ex:articleV1"}}}